{"specVersion":"0.1","messageId":"msg_approval001","transactionId":"txn_purchase0001","documentType":"approval_evidence","sender":"agent:company-a:procurement","recipient":"agent:company-b:sales","createdAt":"2026-08-15T11:05:00Z","expiresAt":"2026-08-16T11:05:00Z","idempotencyKey":"company-a-approval-1","inReplyTo":"msg_accept0001","document":{"acceptanceMessageId":"msg_accept0001","evidenceId":"APR-2026-0001","policyId":"purchase-over-10000-v1","decision":"approved","decidedAt":"2026-08-15T11:04:00Z","approver":"agent:company-a:procurement"}}
