{"specVersion":"0.1","messageId":"msg_shipment002","transactionId":"txn_purchase0001","documentType":"shipment_notice","sender":"agent:company-b:sales","recipient":"agent:company-a:procurement","createdAt":"2026-08-18T08:00:00Z","expiresAt":"2026-08-19T08:00:00Z","idempotencyKey":"company-b-shipment-2","inReplyTo":"msg_receipt0001","document":{"shipmentId":"SHIP-002","purchaseOrderMessageId":"msg_order00001","orderNumber":"PO-2026-0001","shippedAt":"2026-08-18T07:45:00Z","trackingReference":"TRACK-002","lines":[{"rfqLineId":"line-1","quantity":"200","unit":"sheet"}]}}
