{"specVersion":"0.1","messageId":"msg_fulfill001","transactionId":"txn_purchase0001","documentType":"fulfillment_status","sender":"agent:company-b:sales","recipient":"agent:company-a:procurement","createdAt":"2026-08-18T16:00:00Z","expiresAt":"2026-08-19T16:00:00Z","idempotencyKey":"company-b-fulfill-1","inReplyTo":"msg_orderack01","document":{"purchaseOrderMessageId":"msg_order00001","orderNumber":"PO-2026-0001","status":"delivered","occurredAt":"2026-08-18T15:45:00Z","trackingReference":"SHIP-GH-0001"}}
