{"specVersion":"0.1","messageId":"msg_order00001","transactionId":"txn_purchase0001","documentType":"purchase_order","sender":"agent:company-a:procurement","recipient":"agent:company-b:sales","createdAt":"2026-08-15T11:10:00Z","expiresAt":"2026-08-16T11:10:00Z","idempotencyKey":"company-a-order-1","inReplyTo":"msg_approval001","document":{"orderNumber":"PO-2026-0001","quotationMessageId":"msg_quote00001","currency":"GHS","deliveryLocation":"Accra, GH","lines":[{"rfqLineId":"line-1","quantity":"500","unit":"sheet","unitPrice":"85.00","lineTotal":"42500.00"}],"total":"42500.00"}}
