{"specVersion":"0.1","messageId":"msg_settle0001","transactionId":"txn_purchase0001","documentType":"settlement_confirmation","sender":"agent:company-b:sales","recipient":"agent:company-a:procurement","createdAt":"2026-08-19T10:00:00Z","expiresAt":"2026-08-20T10:00:00Z","idempotencyKey":"company-b-settlement-1","inReplyTo":"msg_payresult01","document":{"paymentResultMessageId":"msg_payresult01","settlementReference":"SETTLE-2026-0001","status":"settled","currency":"GHS","amount":"42500.00","occurredAt":"2026-08-19T09:55:00Z"}}
