{"specVersion":"0.1","messageId":"msg_returnauth01","transactionId":"txn_purchase0001","documentType":"return_authorization","sender":"agent:company-b:sales","recipient":"agent:company-a:procurement","createdAt":"2026-08-20T13:00:00Z","expiresAt":"2026-08-21T13:00:00Z","idempotencyKey":"company-b-return-auth-1","inReplyTo":"msg_dispute001","document":{"authorizationId":"RMA-2026-0001","disputeMessageId":"msg_dispute001","orderNumber":"PO-2026-0001","expiresAt":"2026-08-27T13:00:00Z","instructions":"Return to the Accra warehouse","lines":[{"rfqLineId":"line-1","quantity":"100","unit":"sheet","reason":"Damaged in transit"}]}}
