{"specVersion":"0.1","messageId":"msg_receipt0001","transactionId":"txn_purchase0001","documentType":"goods_receipt","sender":"agent:company-a:procurement","recipient":"agent:company-b:sales","createdAt":"2026-08-17T16:00:00Z","expiresAt":"2026-08-18T16:00:00Z","idempotencyKey":"company-a-receipt-1","inReplyTo":"msg_shipment001","document":{"receiptId":"RECEIPT-001","shipmentNoticeMessageId":"msg_shipment001","orderNumber":"PO-2026-0001","receivedAt":"2026-08-17T15:45:00Z","lines":[{"rfqLineId":"line-1","acceptedQuantity":"300","rejectedQuantity":"0","unit":"sheet"}]}}
