{"specVersion":"0.1","messageId":"msg_creditnote1","transactionId":"txn_purchase0001","documentType":"credit_note","sender":"agent:company-b:sales","recipient":"agent:company-a:procurement","createdAt":"2026-08-22T14:00:00Z","expiresAt":"2026-08-23T14:00:00Z","idempotencyKey":"company-b-credit-note-1","inReplyTo":"msg_returnrecv01","document":{"creditNoteNumber":"CN-2026-0001","invoiceMessageId":"msg_invoice001","returnReceiptMessageId":"msg_returnrecv01","currency":"GHS","subtotal":"4250.00","tax":"0.00","total":"4250.00","issuedAt":"2026-08-22T13:55:00Z","reason":"Returned damaged goods"}}
