{"specVersion":"0.1","messageId":"msg_invoice001","transactionId":"txn_purchase0001","documentType":"invoice","sender":"agent:company-b:sales","recipient":"agent:company-a:procurement","createdAt":"2026-08-18T16:10:00Z","expiresAt":"2026-08-19T16:10:00Z","idempotencyKey":"company-b-invoice-1","inReplyTo":"msg_fulfill001","document":{"invoiceNumber":"INV-2026-0001","purchaseOrderMessageId":"msg_order00001","currency":"GHS","subtotal":"42500.00","tax":"0.00","total":"42500.00","dueAt":"2026-09-17T16:10:00Z"}}
