{"specVersion":"0.1","messageId":"msg_cancel_tx01","transactionId":"txn_purchase0001","documentType":"transaction_cancellation","sender":"agent:company-a:procurement","recipient":"agent:company-b:sales","createdAt":"2026-08-15T10:45:00Z","expiresAt":"2026-08-16T10:45:00Z","idempotencyKey":"company-a-cancel-tx-1","inReplyTo":"msg_quote00001","document":{"againstMessageId":"msg_quote00001","reason":"Requirements changed","cancelledAt":"2026-08-15T10:45:00Z"}}
