{"specVersion":"0.1","messageId":"msg_accept0001","transactionId":"txn_purchase0001","documentType":"quotation_acceptance","sender":"agent:company-a:procurement","recipient":"agent:company-b:sales","createdAt":"2026-08-15T11:00:00Z","expiresAt":"2026-08-16T11:00:00Z","idempotencyKey":"company-a-accept-1","inReplyTo":"msg_quote00001","document":{"quotationMessageId":"msg_quote00001"}}
