{"specVersion":"0.1","messageId":"msg_payresult01","transactionId":"txn_purchase0001","documentType":"payment_result","sender":"agent:company-b:sales","recipient":"agent:company-a:procurement","createdAt":"2026-08-18T16:30:00Z","expiresAt":"2026-08-19T16:30:00Z","idempotencyKey":"company-b-payment-result-1","inReplyTo":"msg_payment001","document":{"paymentIntentMessageId":"msg_payment001","resultReference":"PAYRES-2026-0001","status":"captured","currency":"GHS","amount":"42500.00","occurredAt":"2026-08-18T16:29:00Z","provider":"example-provider"}}
