{"specVersion":"0.1","messageId":"msg_dispute001","transactionId":"txn_purchase0001","documentType":"dispute_opened","sender":"agent:company-a:procurement","recipient":"agent:company-b:sales","createdAt":"2026-08-20T10:00:00Z","expiresAt":"2026-08-21T10:00:00Z","idempotencyKey":"company-a-dispute-1","inReplyTo":"msg_settle0001","document":{"disputeId":"DSP-2026-0001","againstMessageId":"msg_settle0001","category":"payment","description":"Settlement amount requires review","currency":"GHS","amount":"42500.00"}}
