{"specVersion":"0.1","messageId":"msg_cancel_rsp1","transactionId":"txn_purchase0001","documentType":"order_cancellation_response","sender":"agent:company-b:sales","recipient":"agent:company-a:procurement","createdAt":"2026-08-15T12:45:00Z","expiresAt":"2026-08-16T12:45:00Z","idempotencyKey":"company-b-cancel-response-1","inReplyTo":"msg_cancel_req1","document":{"cancellationRequestMessageId":"msg_cancel_req1","orderNumber":"PO-2026-0001","accepted":true,"decidedAt":"2026-08-15T12:45:00Z"}}
