{"specVersion":"0.1","messageId":"msg_resolve001","transactionId":"txn_purchase0001","documentType":"dispute_resolved","sender":"agent:company-b:sales","recipient":"agent:company-a:procurement","createdAt":"2026-08-20T12:00:00Z","expiresAt":"2026-08-21T12:00:00Z","idempotencyKey":"company-b-resolve-1","inReplyTo":"msg_dispute001","document":{"disputeId":"DSP-2026-0001","disputeMessageId":"msg_dispute001","resolution":"accepted","resolvedAt":"2026-08-20T11:55:00Z","note":"Settlement confirmed"}}
