{"specVersion":"0.1","messageId":"msg_orderack01","transactionId":"txn_purchase0001","documentType":"order_acknowledgement","sender":"agent:company-b:sales","recipient":"agent:company-a:procurement","createdAt":"2026-08-15T11:20:00Z","expiresAt":"2026-08-16T11:20:00Z","idempotencyKey":"company-b-order-ack-1","inReplyTo":"msg_order00001","document":{"purchaseOrderMessageId":"msg_order00001","orderNumber":"PO-2026-0001","accepted":true,"expectedDeliveryAt":"2026-08-18T16:00:00Z"}}
