{"specVersion":"0.1","messageId":"msg_returnrecv01","transactionId":"txn_purchase0001","documentType":"return_receipt","sender":"agent:company-b:sales","recipient":"agent:company-a:procurement","createdAt":"2026-08-22T13:00:00Z","expiresAt":"2026-08-23T13:00:00Z","idempotencyKey":"company-b-return-receipt-1","inReplyTo":"msg_returnauth01","document":{"receiptId":"RETURN-2026-0001","authorizationMessageId":"msg_returnauth01","receivedAt":"2026-08-22T12:30:00Z","lines":[{"rfqLineId":"line-1","quantity":"100","unit":"sheet"}]}}
