{
  "specVersion": "0.1",
  "messageId": "msg_quote00002",
  "transactionId": "txn_purchase0001",
  "documentType": "quotation",
  "sender": "agent:company-b:sales",
  "recipient": "agent:company-a:procurement",
  "createdAt": "2026-08-15T11:30:00Z",
  "expiresAt": "2026-08-16T11:30:00Z",
  "idempotencyKey": "company-b-quote-2",
  "inReplyTo": "msg_counter001",
  "document": {
    "currency": "GHS", "validUntil": "2026-08-16T10:00:00Z",
    "lines": [{"rfqLineId": "line-1", "quantity": "500", "unit": "sheet", "unitPrice": "82.00", "lineTotal": "41000.00"}],
    "total": "41000.00", "paymentTerms": "30% deposit, balance on delivery",
    "deliveryTerms": "Delivered to Accra within 2 business days"
  }
}
