{"specVersion":"0.1","messageId":"msg_cancel_req1","transactionId":"txn_purchase0001","documentType":"order_cancellation_request","sender":"agent:company-a:procurement","recipient":"agent:company-b:sales","createdAt":"2026-08-15T12:30:00Z","expiresAt":"2026-08-16T12:30:00Z","idempotencyKey":"company-a-cancel-order-1","inReplyTo":"msg_orderack01","document":{"purchaseOrderMessageId":"msg_order00001","orderNumber":"PO-2026-0001","reason":"Project deferred","requestedAt":"2026-08-15T12:30:00Z"}}
